{
  "$schema": "./schemas/dungeon-rewards.schema.json",
  "completionExperience": 200,
  "dailyGold": 20,
  "dailySupplies": {
    "HEALTH_POTION": 1,
    "MANA_POTION": 1
  },
  "supplyStages": [
    "D01_1",
    "D01_2"
  ],
  "supplyPool": [
    {
      "code": "NONE",
      "weight": 70
    },
    {
      "code": "HEALTH_POTION",
      "weight": 15
    },
    {
      "code": "MANA_POTION",
      "weight": 15
    }
  ],
  "firstCompletionExperience": 4800
}
